{
  "snapshotId": "531e64bc9d2c4fb083fd77f800432d41-snapshot",
  "patientId": "patient-001",
  "sessionId": "531e64bc9d2c4fb083fd77f800432d41",
  "productMode": "clinic",
  "capturedAt": "2026-04-07T08:54:50.136569+00:00",
  "language": "en",
  "featurePipelineVersion": "longitudinal-engine-v1",
  "quality": {
    "usability": "usable",
    "coverageScore": 0.77,
    "flags": []
  },
  "embeddings": {
    "speech": {
      "vectorUri": "inline://feature_snapshots/531e64bc9d2c4fb083fd77f800432d41#speech",
      "dimensions": 8,
      "modelVersion": "mock-speech-v1"
    },
    "conversation": {
      "vectorUri": "inline://feature_snapshots/531e64bc9d2c4fb083fd77f800432d41#conversation",
      "dimensions": 8,
      "modelVersion": "mock-conversation-v1"
    },
    "face": {
      "vectorUri": "inline://feature_snapshots/531e64bc9d2c4fb083fd77f800432d41#face",
      "dimensions": 176,
      "modelVersion": "opencv-lbp-face-v1"
    }
  },
  "features": {
    "speech": {
      "embeddingReady": true,
      "sessionRecordAvailable": false
    },
    "conversation": {
      "riskScore": 0.15,
      "screeningClassification": "healthy"
    },
    "taskBehavior": {
      "pause_burden": 0.12000000000000001,
      "speech_fluency": 0.7459999999999999,
      "narrative_coherence": 0.838,
      "recall_consistency": 0.744,
      "support_dependency": 0.27999999999999997
    },
    "visualFace": {
      "face_visibility": 0.88,
      "face_stability": 0.7659999999999999,
      "motion_regularity": 0.764,
      "identity_confidence": 0.9158999999999999,
      "identityLinkId": "531e64bc9d2c4fb083fd77f800432d41-identity-link",
      "timelineInclusion": "include",
      "identityConfidence": 0.94
    }
  },
  "trendContext": {
    "baselineState": "building",
    "windowLabel": "3 months",
    "daysSinceEnrollment": 0
  }
}
